{
  "type": "ROUTINE",
  "label": "Evening check",
  "timezone": "Africa/Cairo",
  "trigger": {
    "kind": "RECURRING",
    "timeOfDay": "21:00"
  },
  "grace": { "seconds": 0 },
  "steps": [
    { "sequence": 1, "offsetSeconds": 0,    "action": "PUSH_SUBJECT" },
    { "sequence": 2, "offsetSeconds": 600,  "action": "PUSH_SUBJECT" },
    { "sequence": 3, "offsetSeconds": 1200, "action": "SMS_SUBJECT" },
    { "sequence": 4, "offsetSeconds": 1500, "action": "MESSAGE_RESPONDER", "targetRole": "PRIMARY" },
    { "sequence": 5, "offsetSeconds": 2700, "action": "MESSAGE_RESPONDER", "targetRole": "BACKUP" }
  ],
  "stopConditions": [
    "SUBJECT_EXPLICIT_CONFIRMATION",
    "RESPONDER_VERIFIED_CONTACT"
  ],
  "contextPolicy": {
    "location": "NEVER",
    "battery": "AFTER_SUBJECT_CALL_FAILED",
    "lastConnection": "CIRCLE_ESCALATION"
  },
  "leaseSeconds": 600
}
